resnet50_HWNC_mixed_batch_8_new.log
{"input": ["cuda", "dense_int8.cuda", [["TENSOR", [8, 2048], "int8"], ["TENSOR", [1000, 2048], "int8"], null, "int32"], {}], "config": {"index": 68155, "code_hash": null, "entity": [["tile_y", "sp", [-1, 1, 4, 2]], ["tile_x", "sp", [-1, 20, 2, 5]], ["tile_k", "sp", [-1, 1]], ["auto_unroll_max_step", "ot", 512]]}, "result": [[2.791660207287772e-06], 0, 1.3745198249816895, 1635227709.093346], "version": 0.2, "tvm_version": "0.7.dev1"}
{"input": ["cuda", "conv2d_HWNCnc_tensorcore.cuda", [["TENSOR", [7, 7, 8, 512], "uint4"], ["TENSOR", [1, 1, 2048, 512], "int4"], [1, 1], [0, 0, 0, 0], [1, 1], "int32"], {}], "config": {"index": 102696, "code_hash": null, "entity": [["block_row_warps", "ot", 1], ["block_col_warps", "ot", 4], ["warp_row_tiles", "ot", 1], ["warp_col_tiles", "ot", 4], ["chunk", "ot", 1], ["fuse_pack", "ot", 0], ["vector_ws", "ot", 8], ["vector_as", "ot", 1], ["reorder_inner", "re", [1, 0]], ["compute_at_AS", "ot", 1], ["compute_at_WS", "ot", 0], ["AS_double_buffer", "ot", 0], ["WS_double_buffer", "ot", 0], ["auto_unroll_max_step", "ot", 0]]}, "result": [[2.805646491204655e-06], 0, 1.3523054122924805, 1635226446.7418513], "version": 0.2, "tvm_version": "0.7.dev1"}
{"input": ["cuda", "conv2d_HWNCnc_tensorcore.cuda", [["TENSOR", [9, 9, 8, 512], "uint4"], ["TENSOR", [3, 3, 512, 512], "int4"], [1, 1], [0, 0, 0, 0], [1, 1], "int32"], {}], "config": {"index": 5774472, "code_hash": null, "entity": [["block_row_warps", "ot", 1], ["block_col_warps", "ot", 1], ["warp_row_tiles", "ot", 8], ["warp_col_tiles", "ot", 2], ["chunk", "ot", 1], ["fuse_pack", "ot", 0], ["vector_ws", "ot", 8], ["vector_as", "ot", 1], ["reorder_inner", "re", [0, 1]], ["compute_at_AS", "ot", 1], ["compute_at_WS", "ot", 2], ["AS_double_buffer", "ot", 1], ["WS_double_buffer", "ot", 0], ["auto_unroll_max_step", "ot", 512]]}, "result": [[2.821441648953301e-06], 0, 1.533496379852295, 1635225142.9559407], "version": 0.2, "tvm_version": "0.7.dev1"}
{"input": ["cuda", "conv2d_HWNCnc_tensorcore.cuda", [["TENSOR", [7, 7, 8, 2048], "uint4"], ["TENSOR", [1, 1, 512, 2048], "int4"], [1, 1], [0, 0, 0, 0], [1, 1], "int32"], {}], "config": {"index": 3960231, "code_hash": null, "entity": [["block_row_warps", "ot", 1], ["block_col_warps", "ot", 4], ["warp_row_tiles", "ot", 1], ["warp_col_tiles", "ot", 1], ["chunk", "ot", 2], ["fuse_pack", "ot", 0], ["vector_ws", "ot", 8], ["vector_as", "ot", 1], ["reorder_inner", "re", [0, 1]], ["compute_at_AS", "ot", 1], ["compute_at_WS", "ot", 3], ["AS_double_buffer", "ot", 1], ["WS_double_buffer", "ot", 1], ["auto_unroll_max_step", "ot", 0]]}, "result": [[2.76962077589132e-06], 0, 1.5362019538879395, 1635223083.807258], "version": 0.2, "tvm_version": "0.7.dev1"}
{"input": ["cuda", "conv2d_HWNCnc_tensorcore.cuda", [["TENSOR", [14, 14, 8, 1024], "uint4"], ["TENSOR", [1, 1, 512, 1024], "int4"], [2, 2], [0, 0, 0, 0], [1, 1], "int32"], {}], "config": {"index": 6618786, "code_hash": null, "entity": [["block_row_warps", "ot", 1], ["block_col_warps", "ot", 4], ["warp_row_tiles", "ot", 1], ["warp_col_tiles", "ot", 16], ["chunk", "ot", 1], ["fuse_pack", "ot", 0], ["vector_ws", "ot", 8], ["vector_as", "ot", 1], ["reorder_inner", "re", [0, 1]], ["compute_at_AS", "ot", 2], ["compute_at_WS", "ot", 1], ["AS_double_buffer", "ot", 0], ["WS_double_buffer", "ot", 1], ["auto_unroll_max_step", "ot", 512]]}, "result": [[2.8694408727514987e-06], 0, 1.5925610065460205, 1635221644.4616578], "version": 0.2, "tvm_version": "0.7.dev1"}
{"input": ["cuda", "conv2d_HWNCnc_tensorcore.cuda", [["TENSOR", [14, 14, 8, 256], "uint4"], ["TENSOR", [1, 1, 1024, 256], "int4"], [1, 1], [0, 0, 0, 0], [1, 1], "int32"], {}], "config": {"index": 3697386, "code_hash": null, "entity": [["block_row_warps", "ot", 1], ["block_col_warps", "ot", 4], ["warp_row_tiles", "ot", 1], ["warp_col_tiles", "ot", 16], ["chunk", "ot", 1], ["fuse_pack", "ot", 0], ["vector_ws", "ot", 1], ["vector_as", "ot", 1], ["reorder_inner", "re", [0, 1]], ["compute_at_AS", "ot", 1], ["compute_at_WS", "ot", 2], ["AS_double_buffer", "ot", 1], ["WS_double_buffer", "ot", 1], ["auto_unroll_max_step", "ot", 0]]}, "result": [[2.8243509416748128e-06], 0, 1.4085183143615723, 1635219736.3118608], "version": 0.2, "tvm_version": "0.7.dev1"}
{"input": ["cuda", "conv2d_HWNCnc_tensorcore.cuda", [["TENSOR", [16, 16, 8, 256], "uint4"], ["TENSOR", [3, 3, 256, 256], "int4"], [1, 1], [0, 0, 0, 0], [1, 1], "int32"], {}], "config": {"index": 7128630, "code_hash": null, "entity": [["block_row_warps", "ot", 1], ["block_col_warps", "ot", 1], ["warp_row_tiles", "ot", 1], ["warp_col_tiles", "ot", 16], ["chunk", "ot", 4], ["fuse_pack", "ot", 0], ["vector_ws", "ot", 1], ["vector_as", "ot", 1], ["reorder_inner", "re", [0, 1]], ["compute_at_AS", "ot", 2], ["compute_at_WS", "ot", 3], ["AS_double_buffer", "ot", 0], ["WS_double_buffer", "ot", 1], ["auto_unroll_max_step", "ot", 512]]}, "result": [[2.8206835415381453e-06], 0, 1.5756688117980957, 1635216242.6806211], "version": 0.2, "tvm_version": "0.7.dev1"}
{"input": ["cuda", "conv2d_HWNCnc_tensorcore.cuda", [["TENSOR", [14, 14, 8, 1024], "uint4"], ["TENSOR", [1, 1, 256, 1024], "int4"], [1, 1], [0, 0, 0, 0], [1, 1], "int32"], {}], "config": {"index": 12399708, "code_hash": null, "entity": [["block_row_warps", "ot", 1], ["block_col_warps", "ot", 2], ["warp_row_tiles", "ot", 1], ["warp_col_tiles", "ot", 16], ["chunk", "ot", 2], ["fuse_pack", "ot", 1], ["vector_ws", "ot", 1], ["vector_as", "ot", 16], ["reorder_inner", "re", [0, 1]], ["compute_at_AS", "ot", 3], ["compute_at_WS", "ot", 3], ["AS_double_buffer", "ot", 1], ["WS_double_buffer", "ot", 1], ["auto_unroll_max_step", "ot", 1500]]}, "result": [[0.0006087591336032389], 0, 1.2406210899353027, 1635212650.7642398], "version": 0.2, "tvm_version": "0.7.dev1"}
{"input": ["cuda", "conv2d_HWNCnc_tensorcore.cuda", [["TENSOR", [28, 28, 8, 512], "uint4"], ["TENSOR", [1, 1, 256, 512], "int4"], [2, 2], [0, 0, 0, 0], [1, 1], "int32"], {}], "config": {"index": 12382158, "code_hash": null, "entity": [["block_row_warps", "ot", 1], ["block_col_warps", "ot", 2], ["warp_row_tiles", "ot", 1], ["warp_col_tiles", "ot", 16], ["chunk", "ot", 8], ["fuse_pack", "ot", 1], ["vector_ws", "ot", 1], ["vector_as", "ot", 1], ["reorder_inner", "re", [0, 1]], ["compute_at_AS", "ot", 3], ["compute_at_WS", "ot", 3], ["AS_double_buffer", "ot", 1], ["WS_double_buffer", "ot", 1], ["auto_unroll_max_step", "ot", 1500]]}, "result": [[0.0006043242989949749], 0, 1.6598799228668213, 1635211680.4739156], "version": 0.2, "tvm_version": "0.7.dev1"}
{"input": ["cuda", "conv2d_HWNCnc_tensorcore.cuda", [["TENSOR", [28, 28, 8, 128], "uint4"], ["TENSOR", [1, 1, 512, 128], "int4"], [1, 1], [0, 0, 0, 0], [1, 1], "int32"], {}], "config": {"index": 9234186, "code_hash": null, "entity": [["block_row_warps", "ot", 1], ["block_col_warps", "ot", 4], ["warp_row_tiles", "ot", 1], ["warp_col_tiles", "ot", 16], ["chunk", "ot", 1], ["fuse_pack", "ot", 0], ["vector_ws", "ot", 1], ["vector_as", "ot", 1], ["reorder_inner", "re", [1, 0]], ["compute_at_AS", "ot", 2], ["compute_at_WS", "ot", 3], ["AS_double_buffer", "ot", 0], ["WS_double_buffer", "ot", 0], ["auto_unroll_max_step", "ot", 1500]]}, "result": [[2.889612312456618e-06], 0, 1.569211721420288, 1635210333.636827], "version": 0.2, "tvm_version": "0.7.dev1"}
{"input": ["cuda", "conv2d_HWNCnc_tensorcore.cuda", [["TENSOR", [30, 30, 8, 128], "uint4"], ["TENSOR", [3, 3, 128, 128], "int4"], [1, 1], [0, 0, 0, 0], [1, 1], "int32"], {}], "config": {"index": 916611, "code_hash": null, "entity": [["block_row_warps", "ot", 1], ["block_col_warps", "ot", 4], ["warp_row_tiles", "ot", 1], ["warp_col_tiles", "ot", 16], ["chunk", "ot", 2], ["fuse_pack", "ot", 0],  ["vector_ws", "ot", 8], ["vector_as", "ot", 1], ["reorder_inner", "re", [0, 1]], ["compute_at_AS", "ot", 2], ["compute_at_WS", "ot", 3], ["AS_double_buffer", "ot", 0], ["WS_double_buffer", "ot", 0], ["auto_unroll_max_step", "ot", 0]]}, "result": [[2.778714087025631e-06], 0, 1.5856270790100098, 1635208141.3445146], "version": 0.2, "tvm_version": "0.7.dev1"}
{"input": ["cuda", "conv2d_HWNCnc_tensorcore.cuda", [["TENSOR", [28, 28, 8, 512], "uint4"], ["TENSOR", [1, 1, 1024, 512], "int4"], [2, 2], [0, 0, 0, 0], [1, 1], "int32"], {}], "config": {"index": 977991, "code_hash": null, "entity": [["block_row_warps", "ot", 1], ["block_col_warps", "ot", 4], ["warp_row_tiles", "ot", 1], ["warp_col_tiles", "ot", 8], ["chunk", "ot", 4], ["fuse_pack", "ot", 0], ["vector_ws", "ot", 8], ["vector_as", "ot", 1], ["reorder_inner", "re", [0, 1]], ["compute_at_AS", "ot", 3], ["compute_at_WS", "ot", 3], ["AS_double_buffer", "ot", 0], ["WS_double_buffer", "ot", 0], ["auto_unroll_max_step", "ot", 0]]}, "result": [[2.8624863908840526e-06], 0, 1.4893901348114014, 1635183262.726071], "version": 0.2, "tvm_version": "0.7.dev1"}
{"input": ["cuda", "conv2d_HWNCnc_tensorcore.cuda", [["TENSOR", [14, 14, 8, 1024], "uint4"], ["TENSOR", [1, 1, 2048, 1024], "int4"], [2, 2], [0, 0, 0, 0], [1, 1], "int32"], {}], "config": {"index": 9660696, "code_hash": null, "entity": [["block_row_warps", "ot", 1], ["block_col_warps", "ot", 4], ["warp_row_tiles", "ot", 1], ["warp_col_tiles", "ot", 4], ["chunk", "ot", 1], ["fuse_pack", "ot", 0], ["vector_ws", "ot", 8], ["vector_as", "ot", 1], ["reorder_inner", "re", [0, 1]], ["compute_at_AS", "ot", 1], ["compute_at_WS", "ot", 1], ["AS_double_buffer", "ot", 1], ["WS_double_buffer", "ot", 0], ["auto_unroll_max_step", "ot", 1500]]}, "result": [[2.7764257638964135e-06], 0, 1.4763009548187256, 1635179695.761148], "version": 0.2, "tvm_version": "0.7.dev1"}
{"input": ["cuda", "conv2d_HWNCnc_tensorcore.cuda", [["TENSOR", [28, 28, 8, 512], "uint4"], ["TENSOR", [1, 1, 128, 512], "int4"], [1, 1], [0, 0, 0, 0], [1, 1], "int32"], {}], "config": {"index": 16524810, "code_hash": null, "entity": [["block_row_warps", "ot", 1], ["block_col_warps", "ot", 1], ["warp_row_tiles", "ot", 1], ["warp_col_tiles", "ot", 8], ["chunk", "ot", 8], ["fuse_pack", "ot", 0], ["vector_ws", "ot", 1], ["vector_as", "ot", 1], ["reorder_inner", "re", [1, 0]], ["compute_at_AS", "ot", 3], ["compute_at_WS", "ot", 3], ["AS_double_buffer", "ot", 1], ["WS_double_buffer", "ot", 1], ["auto_unroll_max_step", "ot", 512]]}, "result": [[3.9366829652996845e-05], 0, 1.371967077255249, 1635173655.905149], "version": 0.2, "tvm_version": "0.7.dev1"}
{"input": ["cuda", "conv2d_HWNCnc_tensorcore.cuda", [["TENSOR", [56, 56, 8, 256], "uint4"], ["TENSOR", [1, 1, 128, 256], "int4"], [2, 2], [0, 0, 0, 0], [1, 1], "int32"], {}], "config": {"index": 23133690, "code_hash": null, "entity": [["block_row_warps", "ot", 1], ["block_col_warps", "ot", 1], ["warp_row_tiles", "ot", 1], ["warp_col_tiles", "ot", 4], ["chunk", "ot", 1], ["fuse_pack", "ot", 0], ["vector_ws", "ot", 1], ["vector_as", "ot", 1], ["reorder_inner", "re", [1, 0]], ["compute_at_AS", "ot", 2], ["compute_at_WS", "ot", 0], ["AS_double_buffer", "ot", 1], ["WS_double_buffer", "ot", 1], ["auto_unroll_max_step", "ot", 1500]]}, "result": [[3.107819549583649e-05], 0, 1.2208013534545898, 1635172141.2952724], "version": 0.2, "tvm_version": "0.7.dev1"}
{"input": ["cuda", "conv2d_HWNCnc_tensorcore.cuda", [["TENSOR", [56, 56, 8, 64], "uint4"], ["TENSOR", [1, 1, 256, 64], "int4"], [1, 1], [0, 0, 0, 0], [1, 1], "int32"], {}], "config": {"index": 732828, "code_hash": null, "entity": [["block_row_warps", "ot", 1], ["block_col_warps", "ot", 2], ["warp_row_tiles", "ot", 1], ["warp_col_tiles", "ot", 1], ["chunk", "ot", 2], ["fuse_pack", "ot", 0], ["vector_ws", "ot", 8], ["vector_as", "ot", 1], ["reorder_inner", "re", [1, 0]], ["compute_at_AS", "ot", 1], ["compute_at_WS", "ot", 1], ["AS_double_buffer", "ot", 0], ["WS_double_buffer", "ot", 0], ["auto_unroll_max_step", "ot", 0]]}, "result": [[0.00012046977187297472], 0, 1.631887674331665, 1635170296.2927148], "version": 0.2, "tvm_version": "0.7.dev1"}
{"input": ["cuda", "conv2d_HWNCnc_tensorcore.cuda", [["TENSOR", [58, 58, 8, 64], "uint4"], ["TENSOR", [3, 3, 64, 64], "int4"], [1, 1], [0, 0, 0, 0], [1, 1], "int32"], {}], "config": {"index": 20153610, "code_hash": null, "entity": [["block_row_warps", "ot", 1], ["block_col_warps", "ot", 1], ["warp_row_tiles", "ot", 1], ["warp_col_tiles", "ot", 8], ["chunk", "ot", 8], ["fuse_pack", "ot", 0], ["vector_ws", "ot", 1], ["vector_as", "ot", 1], ["reorder_inner", "re", [1, 0]], ["compute_at_AS", "ot", 3], ["compute_at_WS", "ot", 2], ["AS_double_buffer", "ot", 1], ["WS_double_buffer", "ot", 0], ["auto_unroll_max_step", "ot", 1500]]}, "result": [[7.882171633924292e-05], 0, 1.416135311126709, 1635168628.7738004], "version": 0.2, "tvm_version": "0.7.dev1"}
{"input": ["cuda", "conv2d_HWNCnc_tensorcore.cuda", [["TENSOR", [56, 56, 8, 256], "uint4"], ["TENSOR", [1, 1, 64, 256], "int4"], [1, 1], [0, 0, 0, 0], [1, 1], "int32"], {}], "config": {"index": 23145255, "code_hash": null, "entity": [["block_row_warps", "ot", 1], ["block_col_warps", "ot", 1], ["warp_row_tiles", "ot", 1], ["warp_col_tiles", "ot", 16], ["chunk", "ot", 8], ["fuse_pack", "ot", 0], ["vector_ws", "ot", 8], ["vector_as", "ot", 1], ["reorder_inner", "re", [1, 0]], ["compute_at_AS", "ot", 2], ["compute_at_WS", "ot", 0], ["AS_double_buffer", "ot", 1], ["WS_double_buffer", "ot", 1], ["auto_unroll_max_step", "ot", 1500]]}, "result": [[4.5981442386831275e-05], 0, 1.3170106410980225, 1635165718.2260303], "version": 0.2, "tvm_version": "0.7.dev1"}
{"input": ["cuda", "conv2d_HWNCnc_tensorcore.cuda", [["TENSOR", [56, 56, 8, 64], "uint4"], ["TENSOR", [1, 1, 64, 64], "int4"], [1, 1], [0, 0, 0, 0], [1, 1], "int32"], {}], "config": {"index": 12636495, "code_hash": null, "entity": [["block_row_warps", "ot", 1], ["block_col_warps", "ot", 1], ["warp_row_tiles", "ot", 1], ["warp_col_tiles", "ot", 2], ["chunk", "ot", 4], ["fuse_pack", "ot", 0], ["vector_ws", "ot", 1], ["vector_as", "ot", 1], ["reorder_inner", "re", [1, 0]], ["compute_at_AS", "ot", 1], ["compute_at_WS", "ot", 0], ["AS_double_buffer", "ot", 0], ["WS_double_buffer", "ot", 1], ["auto_unroll_max_step", "ot", 512]]}, "result": [[2.7050102209550963e-05], 0, 1.5770173072814941, 1635164183.3599703], "version": 0.2, "tvm_version": "0.7.dev1"}
{"input": ["cuda", "conv2d_nhwc_tensorcore_im2col.cuda", [["TENSOR", [8, 230, 230, 3], "int8"], ["TENSOR", [7, 7, 64, 3], "int8"], [2, 2], [0, 0, 0, 0], [1, 1], "NHWC", "int32"], {}], "config": {"index": 12630, "code_hash": null, "entity": [["block_row_warps", "ot", 4], ["block_col_warps", "ot", 2], ["warp_row_tiles", "ot", 2], ["warp_col_tiles", "ot", 2], ["chunk", "ot", 16], ["vector_width", "ot", 16], ["fuse_im2col", "ot", 1]]}, "result": [[0.0003790394698492462], 0, 1.3416614532470703, 1635162975.0112438], "version": 0.2, "tvm_version": "0.7.dev1"}
{"input": ["cuda", "conv2d_HWNCnc_tensorcore.cuda", [["TENSOR", [56, 56, 8, 256], "uint4"], ["TENSOR", [1, 1, 512, 256], "int4"], [2, 2], [0, 0, 0, 0], [1, 1], "int32"], {}], "config": {"index": 9990855, "code_hash": null, "entity": [["block_row_warps", "ot", 1], ["block_col_warps", "ot", 1], ["warp_row_tiles", "ot", 1], ["warp_col_tiles", "ot", 16], ["chunk", "ot", 8], ["fuse_pack", "ot", 0], ["vector_ws", "ot", 8], ["vector_as", "ot", 1], ["reorder_inner", "re", [0, 1]], ["compute_at_AS", "ot", 1], ["compute_at_WS", "ot", 3], ["AS_double_buffer", "ot", 0], ["WS_double_buffer", "ot", 0], ["auto_unroll_max_step", "ot", 512]]}, "result": [[8.400809329299041e-05], 0, 1.2651910781860352, 1635161704.1735132], "version": 0.2, "tvm_version": "0.7.dev1"}
